{
  "id": "b3e7c8a1-4d5f-6e7a-8b9c-0d1e2f3a4b5c",
  "title": "Journey to Dzaleka: A Story of Hope",
  "type": "story",
  "description": "An oral history account of a Congolese family's journey from Bukavu to Dzaleka Refugee Camp in 2015.",
  "language": "en",
  "creator": [
    {
      "name": "Marie Consolée",
      "identifier": "dms-person:marie-consolee",
      "role": "narrator"
    }
  ],
  "date": {
    "created": "2024-03-15",
    "event_date": "2015-08-22"
  },
  "subject": [
    "oral history",
    "displacement",
    "Congo"
  ],
  "subject_ref": [
    {
      "identifier": "dms-subject:oral-history",
      "label": "oral history",
      "scheme": "DMS Subject Taxonomy"
    }
  ],
  "location": {
    "name": "Dzaleka Refugee Camp",
    "identifier": "dms-place:dzaleka-community-center",
    "area": "Community Center",
    "latitude": -13.7833,
    "longitude": 33.9833
  },
  "format": "text/plain",
  "rights": {
    "license": "CC-BY-NC-4.0",
    "access_level": "public",
    "consent_status": "obtained",
    "sensitivity": [
      "trauma-sensitive"
    ],
    "access_note": "Validated for educational reuse.",
    "holder": "Marie Consolée"
  },
  "source": {
    "contributor": "Dzaleka Digital Heritage Project",
    "collection": "Oral Histories 2024",
    "collection_identifier": "dms-collection:oral-histories-2024"
  },
  "technical": {
    "filename": "story_b3e7c8a1.txt",
    "checksum": "1d4e6f8a9b0c2d3e4f567890abcdef1234567890fedcba9876543210abcdef12",
    "checksum_algorithm": "sha256",
    "file_size_bytes": 48123,
    "page_count": 12
  },
  "relation_detail": [
    {
      "target": "urn:dms:source-recording:journey-to-dzaleka",
      "relation_type": "transcription_of"
    }
  ],
  "schema_version": "1.1.0"
}
