{
  "id": "a1f2e3d4-5b6c-7d8e-9f0a-1b2c3d4e5f6a",
  "title": "Market Day at Dzaleka",
  "type": "photo",
  "description": "A vibrant photograph capturing a busy market day at Dzaleka Refugee Camp. The image shows vendors selling produce, textiles, and handmade goods along the main market corridor. Community members from diverse backgrounds are seen interacting, reflecting the multicultural character of the camp.",
  "language": "en",
  "creator": [
    {
      "name": "Amina Uwase",
      "role": "photographer",
      "affiliation": "Dzaleka Youth Media Collective"
    }
  ],
  "date": {
    "created": "2024-06-10",
    "event_date": "2024-05-18"
  },
  "subject": [
    "market",
    "daily life",
    "commerce",
    "community",
    "vendors",
    "multicultural"
  ],
  "location": {
    "name": "Dzaleka Refugee Camp",
    "area": "Market Area",
    "latitude": -13.7841,
    "longitude": 33.9827
  },
  "format": "image/jpeg",
  "rights": {
    "license": "CC-BY-4.0",
    "access_level": "public",
    "holder": "Amina Uwase"
  },
  "source": {
    "contributor": "Dzaleka Youth Media Collective",
    "collection": "Camp Life Photography 2024"
  },
  "schema_version": "1.1.0"
}
